{
  "schema_version": "1.1",
  "namespace": "integration_tests",
  "integration_test": true,
  "link_id": "sample-identification-prerequisite",
  "source_subject": "statistics",
  "source_concept": "Identification",
  "target_subject": "mathematics",
  "target_concept": "Probability convergence",
  "relation": "PREREQUISITE",
  "created_at": "2026-01-01T12:00:00Z",
  "source": "Explicit synthetic tutor statement",
  "evidence_refs": [
    "sample-statistics"
  ]
}
